,EN,JP
S3_D54_C16_DSUBTEXT,; if you fail to stop me here; I will forever be out of the Organization's grasp.,よ、ここで失敗したら、僕は永遠に『キカン』の掌握から外れるだろう。
S1_D55_C16_DSUBTEXT,Let our battle commence!,さあ、争おう！
S1_D2_C17_DSUBTEXT,Foiled again...,また邪魔された...
S1_D4_C17_DSUBTEXT,You're the real deal kid.,お前は本物のAGENTだ
S1_D5_C17_DSUBTEXT,No one but Agent ,今までAGENT
S3_D5_C17_DSUBTEXT, has ever been able to stop me before.,以外は僕を倒せなかった。
S1_D6_C17_DSUBTEXT,You've foiled the scheme of the greatest villain to ever live. You can hold your head up high.,君は史上最強の悪党の企みを邪魔した。胸を張っていい。
S1_D7_C17_DSUBTEXT,Though; to be defeated by someone who's not ,とはいえ、
S3_D7_C17_DSUBTEXT,...,ではないAGENTに負けるなんて...
S1_D8_C17_DSUBTEXT,It feels a bit...,複雑な気分だ。
S1_D10_C17_DSUBTEXT,You don't think he'll be upset; do you?,彼が怒らないといいだが...
S1_D11_C17_DSUBTEXT,He's the one who was a no-show in the first place. There's no room for him to complain.,そもそも、来なかったのはあいつだ。文句を言う余地がない。
S1_D13_C17_DSUBTEXT,Sorry; I'm focusing on ,ごめん、また
S3_D13_C17_DSUBTEXT, when I should be cursing your victory. How rude of me.,のことを夢中になった。君を呪ているはずところに。失礼。
S1_D14_C17_DSUBTEXT,*ahem*,ゴホン
S1_D15_C17_DSUBTEXT,You mindless Organization drone! My beautiful plan has been smashed into pieces because of your nosy peacekeeper group!,『キカン』の社畜めが！あんたの平和の番人組織のせいで僕の美しい計画を台無しにした。
S1_D16_C17_DSUBTEXT,I would have gotten away with it; if you weren't such a meddling agent.,あんたはおせっかいなAGENTでなければ僕はただで済んだはず。
S1_D17_C17_DSUBTEXT,Curse you ,呪ってやるAGENT
S3_D17_C17_DSUBTEXT, the secret agent.,。
S1_D20_C17_DSUBTEXT,This is the part where you take me back to prison.,これは刑務所に連れ戻す場面だよ。
S2_D2_C18_DSUBTEXT,! You've done it!,、やったね！
S1_D3_C18_DSUBTEXT,I suppose it's only natural when you had such an excellent teacher. ,まあ、当たり前だね。こんなにいい師匠があっただから。
S1_D4_C18_DSUBTEXT,Agent ,AGENT
S3_D4_C18_DSUBTEXT,...,...
S4_D4_C18_DSUBTEXT, ,　
S5_D4_C18_DSUBTEXT,What happened to you?,何があったの？老けすぎた。
S1_D5_C18_DSUBTEXT,What's that ,なんだと、AGENT
S3_D5_C18_DSUBTEXT,? Agent ,？
S5_D5_C18_DSUBTEXT, spent 50 years time traveling with the ,くんは50年間ほど
S7_D5_C18_DSUBTEXT, trying to stop me?,を使ってずっとタイムトラベルしていた？
S1_D6_C18_DSUBTEXT,That doesn't make any sense. Is that really how the ,ばかばかしい。本当に
S3_D6_C18_DSUBTEXT, works?,はそういう機能があった？
S1_D7_C18_DSUBTEXT,Not at all. Sorry ,いや、全然。だましてごめんね、
S3_D7_C18_DSUBTEXT,.,。
S1_D9_C18_DSUBTEXT,That was just one of the disguises I keep on hand.,それは手元に置いている変装のひとつに過ぎない。
S1_D10_C18_DSUBTEXT,I wanted you to experience what a real mission would feel like.,新人くんに本物のミッションを体験したかった。
S1_D11_C18_DSUBTEXT,And if you felt like you could keep relying on me; you wouldn't have felt as pressured to succeed.,頼りにし続けられると思えば、成功しなければならないという圧力は感じなかったはずだ。
S1_D12_C18_DSUBTEXT,Oh; come on...,おいおい...
S1_D14_C18_DSUBTEXT,Couldn't you have at least told me? I placed recorded messages specifically addressing you.,せめて教えてくれよ！あんたに話しかけた録画があっちこっちに置いた！
S1_D15_C18_DSUBTEXT,You know how awkward it is for someone else to watch all of those?,部外者がそれらを見たのはちょう恥ずかしいんだけど！
S1_D16_C18_DSUBTEXT,I had no way of knowing the Organization was going to assign me a rookie to train. Besides-,『キカン』が俺に新人を訓練させるつもりだと知らなかった。そもそ―
S1_D17_C18_DSUBTEXT,Did you not care at all about the traps I had prepared?! It's going to be quite some time before I can afford another scheme of this size.,僕が用意した罠にはまったく関心がなかったのか？この規模の計画にはけっこう時間がかかるんだ。
S1_D18_C18_DSUBTEXT,Like I said; the Organization assi-,だから、『キカン』が―
S1_D19_C18_DSUBTEXT,I did all of this so that we could have an epic clash of good versus evil and you send some random other agent instead.,善と悪の壮大な衝突をするために必死に頑張った。けれどこのまったく知らない無関係なAGENTに送った。
S1_D20_C18_DSUBTEXT,No offense ,あ、君は悪くはない
S3_D20_C18_DSUBTEXT,.,さん。
S1_D21_C18_DSUBTEXT,Oh; come on ,まあ、
S3_D21_C18_DSUBTEXT,. It couldn't be helped this time around.,よ、今回は仕方がない。
S1_D23_C18_DSUBTEXT,I promise next time; I'll come to thwart you personally old friend.,次は俺が必ず直接に邪魔をする。約束する、友よ。
S1_D24_C18_DSUBTEXT,*sigh*,はー
S1_D26_C18_DSUBTEXT,...I'll hold you to that.,...絶対だぞ。
